{
  "schema_version": "pals.draft-catalog-coverage-matrix.v1",
  "courses": [
    {"id":"course.elementary","description":"Japanese elementary mathematics"},
    {"id":"course.junior-high","description":"Japanese junior-high mathematics"},
    {"id":"course.math-i","description":"Japanese high-school Mathematics I"},
    {"id":"course.math-a","description":"Japanese high-school Mathematics A"},
    {"id":"course.math-ii","description":"Japanese high-school Mathematics II"},
    {"id":"course.math-b","description":"Japanese high-school Mathematics B"},
    {"id":"course.math-iii","description":"Japanese high-school Mathematics III"},
    {"id":"course.math-c","description":"Japanese high-school Mathematics C"},
    {"id":"course.undergraduate-core","description":"PALS undergraduate mathematics core"}
  ],
  "domains": [
    {"id":"domain.school.number-algebra","description":"School numbers, calculation, and algebra"},
    {"id":"domain.school.measurement","description":"School quantities and measurement"},
    {"id":"domain.school.geometry","description":"School geometry"},
    {"id":"domain.school.functions","description":"School functions and change"},
    {"id":"domain.school.data-probability","description":"School data analysis and probability"},
    {"id":"domain.school.discrete","description":"School counting, sets, logic, and integer structure"},
    {"id":"domain.univ.foundation","description":"Logic and foundations"},
    {"id":"domain.univ.discrete","description":"Discrete mathematics"},
    {"id":"domain.univ.linear","description":"Linear algebra"},
    {"id":"domain.univ.geometry","description":"Geometry"},
    {"id":"domain.univ.calculus","description":"Single-variable calculus"},
    {"id":"domain.univ.analysis","description":"Real analysis"},
    {"id":"domain.univ.multivar","description":"Multivariable calculus"},
    {"id":"domain.univ.ode","description":"Ordinary differential equations"},
    {"id":"domain.univ.prob","description":"Probability and statistics"},
    {"id":"domain.univ.algebra","description":"Abstract algebra"},
    {"id":"domain.univ.number","description":"Number theory"}
  ],
  "stages": [
    {"id":"school.e1","description":"Elementary grade 1","course_id":"course.elementary","domain_ids":["domain.school.number-algebra","domain.school.measurement","domain.school.geometry","domain.school.data-probability"]},
    {"id":"school.e2","description":"Elementary grade 2","course_id":"course.elementary","domain_ids":["domain.school.number-algebra","domain.school.measurement","domain.school.geometry","domain.school.data-probability"]},
    {"id":"school.e3","description":"Elementary grade 3","course_id":"course.elementary","domain_ids":["domain.school.number-algebra","domain.school.measurement","domain.school.geometry","domain.school.data-probability"]},
    {"id":"school.e4","description":"Elementary grade 4","course_id":"course.elementary","domain_ids":["domain.school.number-algebra","domain.school.measurement","domain.school.geometry","domain.school.functions","domain.school.data-probability"]},
    {"id":"school.e5","description":"Elementary grade 5","course_id":"course.elementary","domain_ids":["domain.school.number-algebra","domain.school.measurement","domain.school.geometry","domain.school.functions","domain.school.data-probability"]},
    {"id":"school.e6","description":"Elementary grade 6","course_id":"course.elementary","domain_ids":["domain.school.number-algebra","domain.school.measurement","domain.school.geometry","domain.school.functions","domain.school.data-probability"]},
    {"id":"school.g7","description":"Junior-high grade 7","course_id":"course.junior-high","domain_ids":["domain.school.number-algebra","domain.school.geometry","domain.school.functions","domain.school.data-probability"]},
    {"id":"school.g8","description":"Junior-high grade 8","course_id":"course.junior-high","domain_ids":["domain.school.number-algebra","domain.school.geometry","domain.school.functions","domain.school.data-probability"]},
    {"id":"school.g9","description":"Junior-high grade 9","course_id":"course.junior-high","domain_ids":["domain.school.number-algebra","domain.school.geometry","domain.school.functions","domain.school.data-probability"]},
    {"id":"school.h1","description":"Mathematics I","course_id":"course.math-i","domain_ids":["domain.school.number-algebra","domain.school.geometry","domain.school.functions","domain.school.data-probability"]},
    {"id":"school.ha","description":"Mathematics A","course_id":"course.math-a","domain_ids":["domain.school.geometry","domain.school.discrete","domain.school.data-probability"]},
    {"id":"school.h2","description":"Mathematics II","course_id":"course.math-ii","domain_ids":["domain.school.number-algebra","domain.school.geometry","domain.school.functions"]},
    {"id":"school.hb","description":"Mathematics B","course_id":"course.math-b","domain_ids":["domain.school.number-algebra","domain.school.discrete","domain.school.data-probability"]},
    {"id":"school.h3","description":"Mathematics III","course_id":"course.math-iii","domain_ids":["domain.school.functions","domain.school.geometry"]},
    {"id":"school.hc","description":"Mathematics C","course_id":"course.math-c","domain_ids":["domain.school.geometry","domain.school.discrete"]},
    {"id":"univ.foundation","description":"Undergraduate foundations","course_id":"course.undergraduate-core","domain_ids":["domain.univ.foundation"]},
    {"id":"univ.discrete","description":"Undergraduate discrete mathematics","course_id":"course.undergraduate-core","domain_ids":["domain.univ.discrete"]},
    {"id":"univ.linear","description":"Undergraduate linear algebra","course_id":"course.undergraduate-core","domain_ids":["domain.univ.linear"]},
    {"id":"univ.geometry","description":"Undergraduate geometry","course_id":"course.undergraduate-core","domain_ids":["domain.univ.geometry"]},
    {"id":"univ.calculus","description":"Undergraduate calculus","course_id":"course.undergraduate-core","domain_ids":["domain.univ.calculus"]},
    {"id":"univ.analysis","description":"Undergraduate real analysis","course_id":"course.undergraduate-core","domain_ids":["domain.univ.analysis"]},
    {"id":"univ.multivar","description":"Undergraduate multivariable calculus","course_id":"course.undergraduate-core","domain_ids":["domain.univ.multivar"]},
    {"id":"univ.ode","description":"Undergraduate ordinary differential equations","course_id":"course.undergraduate-core","domain_ids":["domain.univ.ode"]},
    {"id":"univ.prob","description":"Undergraduate probability and statistics","course_id":"course.undergraduate-core","domain_ids":["domain.univ.prob"]},
    {"id":"univ.algebra","description":"Undergraduate abstract algebra","course_id":"course.undergraduate-core","domain_ids":["domain.univ.algebra"]},
    {"id":"univ.number","description":"Undergraduate number theory","course_id":"course.undergraduate-core","domain_ids":["domain.univ.number"]}
  ],
  "modes": [
    {"id": "recognize", "description": "Identify a definition, condition, countercondition, or applicable result."},
    {"id": "compute_construct", "description": "Compute, transform, represent, or construct a mathematical object."},
    {"id": "justify_prove", "description": "Give a reusable deductive justification or proof."},
    {"id": "model_apply", "description": "Translate, apply, interpret, and evaluate a mathematical model or representation."},
    {"id": "counterexample_audit", "description": "Refute a nearby claim or identify a missing hypothesis or invalid step."},
    {"id": "synthesize", "description": "Combine prerequisite concepts or proof techniques across families."}
  ],
  "difficulties": [
    {"id": "introductory", "description": "One primary concept with direct scaffolding."},
    {"id": "standard", "description": "Independent use of the expected curriculum or course technique."},
    {"id": "advanced", "description": "Multi-step or boundary-sensitive use within the declared scope."}
  ],
  "profile_requirements": [
    {"id": "generic_scalar", "status": "generic_exact", "profile_ids": ["generic-v1"], "notes": "Existing scalar arithmetic, order, logic, sets, limits, and supported function symbols are exact."},
    {"id": "generic_symbol_extension", "status": "generic_extension", "profile_ids": ["generic-v1"], "notes": "The carrier is already exact but additional fixed OpenMath symbols are required."},
    {"id": "school_typed", "status": "typed_new", "profile_ids": ["typed-school-math-v1"], "notes": "Quantities, units, native geometry, data, or school probability need an explicit typed profile."},
    {"id": "school_hybrid", "status": "hybrid", "profile_ids": ["generic-v1", "typed-school-math-v1"], "notes": "Scalar subfamilies are generic; native objects or application semantics need the school typed profile."},
    {"id": "typed_discrete", "status": "hybrid", "profile_ids": ["generic-v1", "typed-finite-graph-v1", "typed-discrete-v1"], "notes": "Existing generic and finite-graph slices are partial; relation, recurrence, matching, and coloring need a sibling profile."},
    {"id": "typed_linear_algebra", "status": "hybrid", "profile_ids": ["typed-math-matrix-v1", "typed-commutative-algebra-modules-v1", "typed-linear-algebra-v1", "typed-linear-algebra-v2", "typed-linear-algebra-v3", "typed-linear-algebra-v4", "typed-linear-algebra-v5", "typed-linear-algebra-v6"], "notes": "Finite-dimensional basis, rank, eigen and determinant theorems have a v2 authoring profile; inner-product and spectral families have v3. General matrix calculations have a v4 authoring profile; wider linear algebra remains partial."},
    {"id": "typed_geometry", "status": "hybrid", "profile_ids": ["typed-plane-geometry-v1", "typed-geometry-complex-v1", "typed-geometry-v2"], "notes": "Existing plane and complex profiles cover narrow slices; general incidence and transformation families need an extension."},